{
  "$schema": "../schemas/perk.schema.json",
  "id": "INVENTORY_SPACE_2",
  "name": "Inventory Up II",
  "level": 1,
  "prereq": "INVENTORY_SPACE_1",
  "iconPath": "INVENTORY_SPACE.png",
  "color": { "r": 1, "g": 0.75, "b": 0 },
  "buffs": [
    {
      "inventorySpace": { "amount": 5 }
    }
  ]
}